Topic,Count,Name,Representation,Representative_Docs
-1,646,-1_model_models_framework_data,"['model', 'models', 'framework', 'data', 'performance', 'learning', 'results', 'using', 'methods', 'systems']","['Dataset distillation (DD) has emerged as a prominent approach in data centric machine learning, aiming to synthesize compact training sets for efficient training by compressing the information in large datasets into a small number of synthetic samples. However, DD methods are often evaluated under inconsistent evaluation protocols, ranging from standard ERM to single/multi-teacher supervision, making it difficult to isolate the effectiveness of distilled data from evaluation. Moreover, many prior methods claim that DD outperforms data pruning approaches such as coreset selection (CS), based on the assumption that restricting condensed datasets to subsets of real samples fundamentally limits their expressiveness. In this work, we critically evaluate DD methods through large-scale experiments using standardized datasets and evaluation protocols to assess their intrinsic effectiveness. We benchmark seven state-of-the-art (SOTA) DD methods on ImageNet-1K, ImageNet100, and ImageNette, using three widely adopted training protocols against three CS strategies. Our results show that while some DD methods fail to outperform even simple random subsets, the SOTA DD approaches are comparable to or worse than coresets on large-scale datasets and incur a substantially higher cost for construction. Beyond accuracy, we also evaluate the representativeness, diversity, and quality of condensed sets, and find that coresets consistently achieve better coverage of the original data distribution. These findings highlight the limited practical advantages of current DD methods and show that coresets remain competitive and are often a more computationally efficient alternative for data-centric learning.', 'Seismic resolution enhancement remains a critical challenge in exploration geophysics, particularly when processing field data characterized by limited bandwidth, strong noise, and insufficient labeled training samples. Existing deep learning methods typically rely on supervised learning with synthetic training data, leading to distribution mismatch and poor generalization on real seismic acquisitions. To address these limitations, we develop a physics-guided self-supervised diffusion model (PG-SSDM) that learns directly from field observations without requiring paired high-resolution labels. The proposed framework combines three key innovations. First, a self-supervised training strategy constructs learning targets by progressively filtering the observed data itself, eliminating the need for high-resolution ground truth through iterative refinement across multiple stages. Second, seismic convolution model is embedded as a hard physical constraint in both the training loss function and the reverse sampling process, ensuring that generated high-resolution outputs respect fundamental seismic wave propagation physics. Third, the probabilistic nature of diffusion models enables uncertainty quantification, providing spatial confidence maps that identify regions where resolution enhancement may be less reliable. We validate PG-SSDM on synthetic data under various noise conditions and on a 3D post-stack field dataset. Experimental results demonstrate that the proposed method effectively recovers thin layers and subtle structures, suppresses noise, preserves structural continuity, thereby significantly improving the resolution and interpretability of seismic data.', 'Existing single image dehazing methods are often constrained by computational redundancy in pixel-level optimization and the lack of physical interpretability in implicit neural networks. These limitations hinder the balance between representation efficiency and reconstruction fidelity. To address these issues, we propose Dehaze-GaussianImage, the first zero-shot framework that introduces 2D Gaussian Splatting (2DGS) into the image dehazing domain to break the traditional pixel-grid processing paradigm. Distinct from static convolutional neural networks (CNNs) or Transformers, our approach models hazy images as continuous and dynamically evolvable anisotropic Gaussian fields. Specifically, we propose a novel reconstruction-decoupling zero-shot learning strategy that embeds the atmospheric scattering model into the Gaussian parameter space. This strategy drives Gaussian primitives to adaptively split, clone, and prune during optimization, achieving geometric-level decoupling of the transmission medium and clear textures. Furthermore, explicit structure-preserving constraints are introduced to suppress artifacts commonly caused by traditional physical priors. Experimental results demonstrate that the proposed method achieves state-of-the-art (SOTA) performance in a fully unsupervised manner with minimal parameters, highlighting the potential of explicit Gaussian representation for low-level vision tasks.']"
0,486,0_robot_manipulation_policy_action,"['robot', 'manipulation', 'policy', 'action', 'control', 'framework', 'learning', 'data', 'tasks', 'motion']","['Dexterous manipulation is limited by the cost of collecting large-scale robot demonstrations. Egocentric human videos offer a scalable source of diverse manipulation behaviors, but directly using them for robot learning requires bridging two gaps: the visual gap between human and robot observations, and the action gap between human motion and robot-executable action. We propose EgoEngine, a scalable framework for transforming egocentric human manipulation videos into high-fidelity robot data. Given an egocentric RGB video, EgoEngine produces: (i) a high-fidelity robot observation video replacing human with robot while preserving scene context and temporal alignment, and (ii) a task-aligned, executable robot action trajectory under feasibility constraints. Experiments in simulation and on real robots show that EgoEngine enables scalable conversion of human videos into robot data and, to our knowledge, demonstrates the first zero-shot visuomotor dexterous policy learning from egocentric human videos without real-robot demonstrations. Project website: https://egoengine.github.io.', 'Diffusion-based Vision-Language-Action (VLA) policies have demonstrated strong capability in modeling expressive and multimodal action distributions. However, their reliance on iterative sampling introduces substantial inference latency, which limits their applicability to reactive closed-loop robot manipulation. To address this limitation, we propose \\texttt{ReactVLA}, a lightweight and low-latency VLA framework for real-time robotic manipulation. \\texttt{ReactVLA} combines two complementary designs: (1) an improved Mean Flow (iMF) action generator that reduces expensive multi-step diffusion sampling to one-to-few-step action generation, and (2) Attention Residuals (AttnRes), a dynamic depth-wise feature routing mechanism that replaces uniform residual accumulation to better preserve task-relevant multimodal representations. We evaluate \\texttt{ReactVLA} on large-scale simulation benchmarks, including LIBERO and RoboIMI, as well as real-world robotic manipulation tasks. Experimental results show that \\texttt{ReactVLA} consistently outperforms similarly sized VLA baselines, including SmolVLA and $π_0$. On challenging precision manipulation tasks, \\texttt{ReactVLA} achieves up to a 1.65$\\times$ improvement in task performance while providing more than a 4$\\times$ increase in inference speed compared with leading VLA models. Finally, it reduces real-world policy latency to below 38.6 ms, enabling fast reactive control on physical robot platforms. Please check out our project website at: https://game-loader.github.io/ReactVLA/.', 'Achieving autonomous robotic dexterous manipulation requires precise, human-like action sequences at scale. As a scalable supplement to costly teleoperation data, extracting trajectories with both visual fidelity and physical plausibility from monocular videos represents a promising frontier in embodied AI. To this end, we introduce V2P-Manip, an efficient framework designed to learn dexterous manipulation policies directly from human demonstration videos. We establish an efficient, integrated pipeline encompassing 3D asset acquisition, trajectory estimation, and dexterous policy learning. To bridge the gap between visual perception and physical constraints, we introduce a two-stage refinement process to enforce spatial alignment and physical consistency. Evaluations on the TACO and OakInk benchmarks demonstrate that our approach significantly outperforms previous methods in pose accuracy, adaptability to unstructured environments, and training efficiency. Ultimately, experimental results confirm an average success rate of over 75% across multiple synthetic manipulation tasks and validate the adaptability of the extracted manipulation priors across diverse dexterous hand embodiments.']"
1,478,1_models_agents_ai_model,"['models', 'agents', 'ai', 'model', 'language', 'reasoning', 'llms', 'agent', 'scientific', 'llm']","[""Large language models (LLMs) are increasingly used for tasks once reserved for trained researchers, including hypothesis generation, specification choice, and drafting conclusions. We argue that the reliability of AI-assisted research depends not only on model capability, but also on how cognitive labour is structured between humans and machines. We study this problem through Human-in-the-Loop Economic Research (HLER), a decision architecture based on pre-commitment, decision sequencing, accountability, and attention allocation. In a pre-specified 2*4 factorial experiment with 280 complete research runs across four datasets, an unconstrained multi-agent baseline produced critical failures in 72% of runs. Using the same underlying model, the same agent decomposition, and identical prompts for the shared reasoning agents, HLER reduced the failure rate to 16% by imposing three architectural commitments: LLMs reason but do not execute data work, data and estimation are handled deterministically, and three human decision gates bind the workflow. Fisher's exact test rejects equality of failure rates at p<0.001. Reliability gains were largest on the least publicly represented dataset, a Qing-dynasty population register, consistent with a task-based production model with Frechet-distributed output quality. An 80-run ablation suggests that deterministic computation and human gates contribute independently, with exploratory evidence of complementarity. We interpret HLER as a research harness rather than an autonomous AI scientist: it sharply reduces failures, makes residual weaknesses more visible, and prevents unreliable claims from being advanced as publication-ready outputs."", 'Deep research agents are Large Language Model (LLM)-based systems designed for autonomous, multi-step scientific reasoning, and they hold immense potential for accelerating research in the physical sciences. However, comprehensive and in-depth evaluations of their capabilities within this domain remain lacking. To address this gap, we introduce PhySciBench, a benchmark highly relevant to physical science research, comprising 200 expert-curated questions, balanced between physics and chemistry, across six task categories that reflect real-world scientific workflows. Evaluations of state-of-the-art models and agent systems on PhySciBench reveal limited performance; even the strongest baseline, Gemini Deep Research, achieves an accuracy of only 33.5%. Analysis of failure cases identifies three recurrent deficiencies: fragility in extended reasoning chains, limited knowledge transfer across steps, and a lack of physics-grounded self-verification. Motivated by these findings, we develop DelveAgent, a modular multi-agent framework equipped with an adaptive planning loop, dual-granularity memory, and a hierarchical physics-grounded reflection mechanism. Across four scientific benchmarks, DelveAgent improves accuracy by up to 7.5 percentage points while reducing inference costs to approximately one-third of the strongest baseline. These results establish the significance of PhySciBench as a critical benchmark for evaluating AI systems in the physical sciences and demonstrate that architectural specialization can effectively enhance the reliability of autonomous scientific research.', 'AI agents are increasingly being developed to accelerate scientific discovery, yet their practical capabilities in real research settings remain poorly understood. Existing benchmarks for AI agents rarely capture the complexity, heterogeneity, and extended reasoning required by scientific work, whereas benchmarks for scientific tasks often reduce research to static, direct problems and provide limited support for interactive evaluation. Here, we introduce SciAgentArena, a systematic benchmark for evaluating AI agents in real-world scientific research scenarios drawn from emerging needs across multiple domains. SciAgentArena comprises approximately 200 tasks with stepwise verification and an interactive, agent-agnostic environment for assessing diverse AI agents. Using this benchmark, we find that current agents can contribute effectively to well-specified data-analysis workflows, particularly when the task structure and evaluation criteria are clear. However, their performance remains uneven across scientific contexts: agents struggle to generate genuinely novel insights, sustain self-directed exploration, and formulate robust solutions for open-ended research questions. We further characterize common failure modes across agents and identify opportunities for improving their reliability, autonomy, and scientific reasoning. Together, SciAgentArena provides a practical framework for measuring progress in AI agents for science and for guiding the design of future agents capable of addressing complex scientific challenges. Full codes, tasks, and datasets can be accessed via this link: https://sciagentarena.github.io/.']"
2,271,2_data_model_neural_framework,"['data', 'model', 'neural', 'framework', 'learning', 'models', 'methods', 'structure', 'discovery', 'method']","['Digital twin modeling, including control and data assimilation under model uncertainty, often faces an open-ended fidelity problem: adding variables, data streams, and time scales can indefinitely increase model complexity, ultimately producing systems that are difficult to maintain, validate, interpret, and use for stress or safety testing. As an alternative, one can seek parsimonious stochastic surrogate models built only on the variables needed to describe the relevant quantities of interest. We introduce a framework for discovering such variables from observational data by identifying which candidate inputs influence the full conditional law of a target quantity, rather than only its conditional mean. This distinction is essential in stochastic, coarse-grained, or partially observed systems, where dependencies may appear through changes in variability, tail behavior, multimodality, or uncertainty rather than through deterministic functional relationships. The framework couples conditional generative modeling, which learns the conditional distribution of the target given candidate inputs, with Gaussian-process-based analysis of variance (through kernel mode decomposition), which enables iterative pruning of non-influential inputs and interpretable structure discovery. In control settings, the resulting surrogate can be interpreted as a learned Markov decision process: the method identifies not only a transition model, but also the state, action, and memory variables needed to make the learned dynamics effectively Markovian. Across examples involving stochastic dynamical systems, missing variables, PDE control, reinforcement learning, and economic data, the discovered structures yield interpretable stochastic surrogates whose downstream performance is comparable to models trained on the full variable set.', 'Operator learning is an emerging interdisciplinary field that integrates machine learning with scientific computing. By mapping infinite-dimensional function spaces, this approach provides an efficient surrogate modeling framework for high-dimensional partial differential equations (PDEs). Compared to traditional numerical solvers, it achieves a superior trade-off between computational complexity and approximation accuracy, demonstrating significant advantages in many-query tasks such as real-time prediction and parameter sweeps. Given the stringent accuracy requirements of both forward simulation and inverse inference, as well as the precision bottlenecks of existing operator learning methods in handling complex boundaries or long-term evolution, we propose the Starter-Iterator Neural Operator (SINO). Our framework reinterprets the initialization strategies and iterative formats of traditional iterative methods through neural networks, establishing an efficient approach for spectral-spatiotemporal collaborative modeling. Specifically, the frequency-domain initialization module captures globally stable low-frequency features, while the time-domain learning module focuses on optimizing local solution residuals, thereby effectively overcoming the inherent limitations of conventional single-domain modeling approaches. Extensive experiments on typical dynamical systems such as the Navier-Stokes equations and acoustic wave equations, as well as practical applications including super-resolution imaging and weather forecasting, demonstrate that SINO achieves outstanding performance in numerical accuracy, generalization capability, and robustness.', 'Bayesian inference provides a principled framework for uncertainty quantification in scientific machine learning. However, conventional Bayesian approaches usually require solving a new inference problem for each observation set, causing substantial computational costs that hinder real-time applications like online monitoring and digital twins. Furthermore, inferring over infinite-dimensional function spaces with varying observation sets poses major challenges for existing amortized inference methods. In this work, we propose Flow-ABI, a flow-based generative framework for amortized Bayesian inference in regression and inverse partial differential equation (PDE) problems. It consists of two components: (i) a functional prior model that learns expressive priors from historical data and physical knowledge through flow matching, and (ii) a set-conditioned functional posterior sampler mapping observation sets to functional posterior distributions. The learned posterior model naturally accommodates varying, permutation-invariant observation sets, and generalizes across different observation discretizations. Once trained, Flow-ABI enables near-real-time posterior sampling for previously unseen observations without retraining or iterative optimization. The proposed methodology can be seamlessly integrated with a wide class of scientific machine learning frameworks, including physics-informed neural networks and neural operators, for uncertainty-aware inverse PDE modeling. Experiments demonstrate that Flow-ABI accurately captures both Gaussian and non-Gaussian posterior distributions while achieving over two-order-of-magnitude speedups relative to the gold-standard Bayesian inference method, Hamiltonian Monte Carlo. These results show Flow-ABI is an effective, scalable, and computationally efficient framework for uncertainty quantification in scientific machine learning.']"
3,230,3_quantum_states_phase_systems,"['quantum', 'states', 'phase', 'systems', 'coupling', 'results', 'model', 'symmetry', 'state', 'using']","['Demultiplexers are the fundamental primitives of network architecture, enabling perfect routing of an input classical signal to a designated one, among multiple output ports. Quantum transmission lines, having access to the quantum systems directly, are able to transmit both the classical and quantum information encoded in quantum systems. A natural question therefore emerges that whether the scrambled classical and quantum information in a quantum system can be perfectly demultiplexed in the designated classical and quantum output ports? Here we answer this question by introducing a quantum to quantum-classical device, namely the quantum demultiplexer (Q-DEMUX). We characterize the class of Q-DEMUXs enabling perfect routing of both the classical and the quantum information along with their simple circuit realizations. Our results highlight an explicit connection between the strength of a Q-DEMUX with the incompatibility of quantum instruments. Finally, we extend the notion in a stronger variant where the sender is oblivious regarding the nature of the data to be transmitted through the Q-DEMUX.', 'Visualizing the d-valued quantum state-space of quantum systems serves as a foundational pillar for the scientific research and practical applications in quantum computing and information science, where d >= 2. The 2-valued quantum states of a qubit are elegantly visualized on the three-dimensional Bloch sphere. In contrast, expanding this geometrical paradigm to visualize higher d-valued quantum states of a qudit (d >= 3), e.g., a qutrit (d=3), ququadit (d=4), and quintit (d=5), leads to severe structural and topological complexities. This paper introduces a new generalized three-dimensional framework to effectively visualize higher d-valued quantum states of a qudit, in the aspects of ease of illustration, structural simplicity, and natural representation for researchers and engineers. We called this new framework the ""multi-axial projective sphere (MAPS)"", which consists of n projectional intersecting spatial axes, where 0 <= n <= d-1. We also propose a group of novel d-valued phase axial-based gates, to swivel and shift d-valued quantum states of a qudit along these n axes. Our generalized framework could be used for visualizing high-dimensional data for practical applications, e.g., machine learning, quantum machine learning, and quantum chemistry, where every axis of the MAPS represents a single feature of such data with its corresponding distinct values.', 'We investigate frustration-induced instabilities in a trimerized quantum spin chain motivated by recent experimental findings for the compound Na$_2$Cu$_3$Ge$_4$O$_{12}$. Employing a cluster mean-field approach combined with Lanczos exact diagonalization, we analyze the ground-state and quantum-information properties of a Heisenberg model with competing interactions in a magnetic field. In the weakly frustrated regime, the system exhibits a robust $1/3$ magnetization plateau associated with a collective ferrimagnetic-like trimer state. Increasing the next-nearest-neighbor intratrimer coupling drives a pronounced reorganization of spin correlations, leading to a crossover toward a doublon-like correlation regime and providing a static ground-state picture consistent with the composite excitations observed dynamically in trimerized chains. The resulting low-energy behavior can be interpreted in terms of weakly interacting emergent spins, offering a microscopic explanation for the extended stability of the magnetization plateau. Furthermore, through finite-size scaling analyses of the energy gap, von Neumann entanglement entropy, and fidelity susceptibility, we characterize the zero-field criticality of the model. Ultimately, our results suggest that frustration gives rise to qualitatively distinct quantum states and provide a microscopic framework for understanding the emergence of fractionalized excitations in trimerized quantum spin systems.']"
